protein_id	fasta_headers	gene_symbols_or_id	KO_1	KO_2	KO_3	WT_1	WT_2	WT_3
P51660	>sp|P51660|DHB4_MOUSE Peroxisomal multifunctional enzyme type 2 OS=Mus musculus OX=10090 GN=Hsd17b4 PE=1 SV=3	HSD17B4	15.594126722353	16.2087501765079	16.4287919530649	15.6504348945126	12.965266670681	15.8345170356435
P11499	>sp|P11499|HS90B_MOUSE Heat shock protein HSP 90-beta OS=Mus musculus OX=10090 GN=Hsp90ab1 PE=1 SV=3	HSP90AB1	13.7014731012103	13.4930017802368	12.9599467745424	13.662060239321	13.3764965574709	13.1766400560426
P08113	>sp|P08113|ENPL_MOUSE Endoplasmin OS=Mus musculus OX=10090 GN=Hsp90b1 PE=1 SV=2	HSP90B1				12.6129729209585	11.0826026252526	12.0382878562705
Q8K0U4	>sp|Q8K0U4|HS12A_MOUSE Heat shock 70 kDa protein 12A OS=Mus musculus OX=10090 GN=Hspa12a PE=1 SV=1	HSPA12A	12.6997220731053	12.4236660680774	12.1830124309383	12.4703877767949	12.5355892373051	12.4580484629058
P20029	>sp|P20029|BIP_MOUSE Endoplasmic reticulum chaperone BiP OS=Mus musculus OX=10090 GN=Hspa5 PE=1 SV=3	HSPA5	14.3250595125825	13.0531382280057	12.6051860820104	14.3157205090234	14.2205850598968	14.8617545283742
P63017	>sp|P63017|HSP7C_MOUSE Heat shock cognate 71 kDa protein OS=Mus musculus OX=10090 GN=Hspa8 PE=1 SV=1	HSPA8	15.075943011762	15.0500909649171	15.2182132585079	15.4717117990912	15.465385151472	15.5626970106593
P38647	>sp|P38647|GRP75_MOUSE Stress-70 protein, mitochondrial OS=Mus musculus OX=10090 GN=Hspa9 PE=1 SV=3	HSPA9	14.6194191089503	14.4875782931599	14.0946913902082	14.7911077446122	14.4573794694638	14.7242110959408
P63038	>sp|P63038|CH60_MOUSE 60 kDa heat shock protein, mitochondrial OS=Mus musculus OX=10090 GN=Hspd1 PE=1 SV=1	HSPD1	14.0477566922411	15.8568780749857	15.4557133625452	15.4661820119922	15.2965177610042	14.4315566749938
F6RPJ9	>tr|F6RPJ9|F6RPJ9_MOUSE Isoform of Q9JHR7, Insulin-degrading enzyme (Fragment) OS=Mus musculus OX=10090 GN=Ide PE=1 SV=1	IDE				13.9672694469292	14.4339757579157	14.4094864203059
Q91VA7	>tr|Q91VA7|Q91VA7_MOUSE Isocitrate dehydrogenase [NAD] subunit, mitochondrial OS=Mus musculus OX=10090 GN=Idh3b PE=1 SV=1	IDH3B	13.1706917555338	12.7584478570241	12.8037809011205	13.8590412012621	12.8618650570388	13.5623646204921
A0A075B5P6;A0A075B6A0;P01872	>tr|A0A075B5P6|A0A075B5P6_MOUSE Isoform of P01872, Immunoglobulin heavy constant mu (Fragment) OS=Mus musculus OX=10090 GN=Ighm PE=1 SV=1;>tr|A0A075B6A0|A0A075B6A0_MOUSE Isoform of P01872, Immunoglobulin heavy constant mu (Fragment) OS=Mus musculus OX=10090 GN=Ighm PE=1 SV=2;>sp|P01872|IGHM_MOUSE Immunoglobulin heavy constant mu OS=Mus musculus OX=10090 GN=Ighm PE=1 SV=2	IGHM	15.9685792765038	15.4574784021909	15.1095621285153	15.4088970286085	15.2445245695319	15.2174568767827
A0A0B4J1K5	>tr|A0A0B4J1K5|A0A0B4J1K5_MOUSE Immunoglobulin lambda variable 3 (Fragment) OS=Mus musculus OX=10090 GN=Iglv3 PE=4 SV=1	IGLV3				9.3478473658222	9.1638882565731	8.84910505935037
A0A0R4J117;G3UYZ1;Q8R366	>tr|A0A0R4J117|A0A0R4J117_MOUSE Isoform of Q8R366, Immunoglobulin superfamily member 8 OS=Mus musculus OX=10090 GN=Igsf8 PE=1 SV=1;>tr|G3UYZ1|G3UYZ1_MOUSE Isoform of Q8R366, Immunoglobulin superfamily member 8 OS=Mus musculus OX=10090 GN=Igsf8 PE=1 SV=1;>sp|Q8R366|IGSF8_MOUSE Immunoglobulin superfamily member 8 OS=Mus musculus OX=10090 GN=Igsf8 PE=1 SV=2	IGSF8	13.1332580488841	14.3537970125391	14.2966291217635	13.1994375906284	13.8080611251875	13.710393061643
A0A1L1SR84;E9PZ19	>tr|A0A1L1SR84|A0A1L1SR84_MOUSE Isoform of E9PZ19, Protein turtle homolog B OS=Mus musculus OX=10090 GN=Igsf9b PE=1 SV=1;>sp|E9PZ19|TUTLB_MOUSE Protein turtle homolog B OS=Mus musculus OX=10090 GN=Igsf9b PE=1 SV=1	IGSF9B	13.1957633186926	13.2502262785996	13.9444121767472	12.0310640202034	12.4589924290508	12.699054145908
Q8CAQ8	>sp|Q8CAQ8|MIC60_MOUSE MICOS complex subunit Mic60 OS=Mus musculus OX=10090 GN=Immt PE=1 SV=1	IMMT	14.3378286485729	14.2600623434357	14.631588996588	14.163524889064	14.2234325972368	14.2812739881141
P59644	>sp|P59644|PI5PA_MOUSE Phosphatidylinositol 4,5-bisphosphate 5-phosphatase A OS=Mus musculus OX=10090 GN=Inpp5j PE=1 SV=2	INPP5J				12.828303402626	12.4996601610791	13.6107773970671
A4GZ26;D3Z5I6;D3Z6V7;E9QAD8;Q5DU25	>tr|A4GZ26|A4GZ26_MOUSE Isoform of Q5DU25, ARF6 guanine nucleotide exchange factor IQArfGEF OS=Mus musculus OX=10090 GN=Iqsec2 PE=1 SV=1;>tr|D3Z5I6|D3Z5I6_MOUSE Isoform of Q5DU25, IQ motif and SEC7 domain-containing protein 2 OS=Mus musculus OX=10090 GN=Iqsec2 PE=1 SV=1;>tr|D3Z6V7|D3Z6V7_MOUSE Isoform of Q5DU25, IQ motif and SEC7 domain-containing protein 2 OS=Mus musculus OX=10090 GN=Iqsec2 PE=1 SV=1;>tr|E9QAD8|E9QAD8_MOUSE Isoform of Q5DU25, IQ motif and SEC7 domain-containing protein 2 OS=Mus musculus OX=10090 GN=Iqsec2 PE=1 SV=1;>sp|Q5DU25|IQEC2_MOUSE IQ motif and SEC7 domain-containing protein 2 OS=Mus musculus OX=10090 GN=Iqsec2 PE=1 SV=3	IQSEC2				13.1428669951775	13.429035031191	13.079868877868
P97431	>sp|P97431|IRF6_MOUSE Interferon regulatory factor 6 OS=Mus musculus OX=10090 GN=Irf6 PE=1 SV=2	IRF6				19.5601479723266	19.6518295309569	19.7442815066014
Q8C863	>sp|Q8C863|ITCH_MOUSE E3 ubiquitin-protein ligase Itchy OS=Mus musculus OX=10090 GN=Itch PE=1 SV=2	ITCH				12.3023264171268	12.4049167845274	12.0651506180372
P11881	>sp|P11881|ITPR1_MOUSE Inositol 1,4,5-trisphosphate receptor type 1 OS=Mus musculus OX=10090 GN=Itpr1 PE=1 SV=2	ITPR1	13.0634420830458	13.326574313389	13.22213685316	13.8529368462586	13.9230664326239	13.8760304912411
Q02257	>sp|Q02257|PLAK_MOUSE Junction plakoglobin OS=Mus musculus OX=10090 GN=Jup PE=1 SV=3	JUP	9.04991995204634	9.38035590911475	9.99696941694626	11.7041967711121	9.94621023990011	10.7226797650344
P15388	>sp|P15388|KCNC1_MOUSE Potassium voltage-gated channel subfamily C member 1 OS=Mus musculus OX=10090 GN=Kcnc1 PE=1 SV=1	KCNC1	11.246717422072	11.0351473644645	11.0730219294578	12.1056611265958	11.1814999613284	11.92049490365
D3YZV2;E9QKI2;Q63959	>tr|D3YZV2|D3YZV2_MOUSE Isoform of Q63959, Potassium voltage-gated channel subfamily C member 3 OS=Mus musculus OX=10090 GN=Kcnc3 PE=1 SV=1;>tr|E9QKI2|E9QKI2_MOUSE Isoform of Q63959, Potassium voltage-gated channel subfamily C member 3 OS=Mus musculus OX=10090 GN=Kcnc3 PE=1 SV=1;>sp|Q63959|KCNC3_MOUSE Potassium voltage-gated channel subfamily C member 3 OS=Mus musculus OX=10090 GN=Kcnc3 PE=1 SV=2	KCNC3				14.1590950066813	14.1364524425655	14.2385906411974
Q9Z0V2	>sp|Q9Z0V2|KCND2_MOUSE Potassium voltage-gated channel subfamily D member 2 OS=Mus musculus OX=10090 GN=Kcnd2 PE=1 SV=1	KCND2	13.4410180876871	13.4641260711498	11.7638654788084			
A0A0R4J2B2;Q6WVG3	>tr|A0A0R4J2B2|A0A0R4J2B2_MOUSE Isoform of Q6WVG3, BTB/POZ domain-containing protein KCTD12 OS=Mus musculus OX=10090 GN=Kctd12 PE=1 SV=1;>sp|Q6WVG3|KCD12_MOUSE BTB/POZ domain-containing protein KCTD12 OS=Mus musculus OX=10090 GN=Kctd12 PE=1 SV=1	KCTD12	14.2991631735366	14.4679233851878	14.607329732596	15.1488620391591	15.1304373212589	15.1630354642951
Q8CF66	>sp|Q8CF66|LTOR4_MOUSE Ragulator complex protein LAMTOR4 OS=Mus musculus OX=10090 GN=Lamtor4 PE=1 SV=2	LAMTOR4	17.06727646379	16.9954250821643	17.1335661699322	16.8541365559667	16.9081958995057	16.9168428493775
Q9Z2I0	>sp|Q9Z2I0|LETM1_MOUSE Mitochondrial proton/calcium exchanger protein OS=Mus musculus OX=10090 GN=Letm1 PE=1 SV=1	LETM1	14.0091945747605	13.3113960056959	14.2289481541885	13.5057549863082	14.0842220244562	12.0177564432368
Q8JZS0	>sp|Q8JZS0|LIN7A_MOUSE Protein lin-7 homolog A OS=Mus musculus OX=10090 GN=Lin7a PE=1 SV=2	LIN7A				12.730431912797	12.7586072643495	12.2408960112613
A0A0R4J0S4;Q80Y17	>tr|A0A0R4J0S4|A0A0R4J0S4_MOUSE Isoform of Q80Y17, Lethal(2) giant larvae protein homolog 1 OS=Mus musculus OX=10090 GN=Llgl1 PE=1 SV=1;>sp|Q80Y17|L2GL1_MOUSE Lethal(2) giant larvae protein homolog 1 OS=Mus musculus OX=10090 GN=Llgl1 PE=1 SV=1	LLGL1	13.1794756826533	12.0847533179559	12.0011708835107	13.1404669773331	13.5762648632732	13.577350558292
Q8CGK3	>sp|Q8CGK3|LONM_MOUSE Lon protease homolog, mitochondrial OS=Mus musculus OX=10090 GN=Lonp1 PE=1 SV=2	LONP1				13.2734372258213	12.9646230918574	13.3913662077463
Q6PB66	>sp|Q6PB66|LPPRC_MOUSE Leucine-rich PPR motif-containing protein, mitochondrial OS=Mus musculus OX=10090 GN=Lrpprc PE=1 SV=2	LRPPRC				11.5324713679607	11.5340875378272	12.708857467488
Q8K2F8	>sp|Q8K2F8|LS14A_MOUSE Protein LSM14 homolog A OS=Mus musculus OX=10090 GN=Lsm14a PE=1 SV=1	LSM14A	10.3770302139675	9.04552575140896	10.0391731380225			
A0A087WPR1;P20917;Q3ZB60	>tr|A0A087WPR1|A0A087WPR1_MOUSE Isoform of P20917, Myelin-associated glycoprotein OS=Mus musculus OX=10090 GN=Mag PE=1 SV=1;>sp|P20917|MAG_MOUSE Myelin-associated glycoprotein OS=Mus musculus OX=10090 GN=Mag PE=1 SV=2;>tr|Q3ZB60|Q3ZB60_MOUSE Isoform of P20917, Mag protein (Fragment) OS=Mus musculus OX=10090 GN=Mag PE=1 SV=1	MAG	14.0402689605948	14.006834297722	14.4733447726796	14.1633716421007	13.9725855754808	13.3518729389489
A0A0G2JE00;A0A0G2JEG6;Q9WVQ1	>tr|A0A0G2JE00|A0A0G2JE00_MOUSE Isoform of Q9WVQ1, Membrane-associated guanylate kinase, WW and PDZ domain-containing protein 2 OS=Mus musculus OX=10090 GN=Magi2 PE=1 SV=1;>tr|A0A0G2JEG6|A0A0G2JEG6_MOUSE Isoform of Q9WVQ1, Membrane-associated guanylate kinase, WW and PDZ domain-containing protein 2 OS=Mus musculus OX=10090 GN=Magi2 PE=1 SV=1;>sp|Q9WVQ1|MAGI2_MOUSE Membrane-associated guanylate kinase, WW and PDZ domain-containing protein 2 OS=Mus musculus OX=10090 GN=Magi2 PE=1 SV=2	MAGI2	13.8348014996581	13.8942767785279	13.781597738195	14.3956382771447	14.4780260426215	14.689252029172
A0A140T8T5;E9PZ43;P27546	>tr|A0A140T8T5|A0A140T8T5_MOUSE Isoform of P27546, Microtubule-associated protein OS=Mus musculus OX=10090 GN=Map4 PE=1 SV=1;>tr|E9PZ43|E9PZ43_MOUSE Isoform of P27546, Microtubule-associated protein OS=Mus musculus OX=10090 GN=Map4 PE=1 SV=3;>sp|P27546|MAP4_MOUSE Microtubule-associated protein 4 OS=Mus musculus OX=10090 GN=Map4 PE=1 SV=3	MAP4				12.3345428015331	11.092622699831	11.5163604159634
D3Z6W1;Q7TSJ2	>tr|D3Z6W1|D3Z6W1_MOUSE Isoform of Q7TSJ2, Microtubule-associated protein 6 OS=Mus musculus OX=10090 GN=Map6 PE=1 SV=1;>sp|Q7TSJ2|MAP6_MOUSE Microtubule-associated protein 6 OS=Mus musculus OX=10090 GN=Map6 PE=1 SV=2	MAP6	12.9383399880577	12.6515570523812	13.0288324236596	15.7751466862324	16.7580606868048	15.7871574383376
E0CZH6;Q922Q1	>tr|E0CZH6|E0CZH6_MOUSE Isoform of Q922Q1, Mitochondrial amidoxime reducing component 2 (Fragment) OS=Mus musculus OX=10090 GN=Marc2 PE=1 SV=1;>sp|Q922Q1|MARC2_MOUSE Mitochondrial amidoxime reducing component 2 OS=Mus musculus OX=10090 GN=Marc2 PE=1 SV=1	MARC2				12.6556963622061	13.4523770809305	13.5950994846235
P26645	>sp|P26645|MARCS_MOUSE Myristoylated alanine-rich C-kinase substrate OS=Mus musculus OX=10090 GN=Marcks PE=1 SV=2	MARCKS	11.3844846678853	11.2481099810948	9.10723986535736	11.0931185831424	10.803907530349	11.1967723987938
A0A0R4J0B1;A0A0R4J227;A0A1Y7VNZ6;E9PYX3;E9Q9N6;E9QMP6;F6ZS70;Q03141;Q05512;Q3T9A3;Q8VHJ5	>tr|A0A0R4J0B1|A0A0R4J0B1_MOUSE Isoform of Q05512, Non-specific serine/threonine protein kinase OS=Mus musculus OX=10090 GN=Mark2 PE=1 SV=1;>tr|A0A0R4J227|A0A0R4J227_MOUSE Isoform of Q05512, Non-specific serine/threonine protein kinase OS=Mus musculus OX=10090 GN=Mark2 PE=1 SV=1;>tr|A0A1Y7VNZ6|A0A1Y7VNZ6_MOUSE Isoform of Q03141, Non-specific serine/threonine protein kinase OS=Mus musculus OX=10090 GN=Mark3 PE=1 SV=1;>tr|E9PYX3|E9PYX3_MOUSE Isoform of Q05512, Non-specific serine/threonine protein kinase OS=Mus musculus OX=10090 GN=Mark2 PE=1 SV=1;>tr|E9Q9N6|E9Q9N6_MOUSE Isoform of Q05512, Non-specific serine/threonine protein kinase OS=Mus musculus OX=10090 GN=Mark2 PE=1 SV=1;>tr|E9QMP6|E9QMP6_MOUSE Isoform of Q05512, Non-specific serine/threonine protein kinase OS=Mus musculus OX=10090 GN=Mark2 PE=1 SV=2;>tr|F6ZS70|F6ZS70_MOUSE Isoform of Q05512, Non-specific serine/threonine protein kinase (Fragment) OS=Mus musculus OX=10090 GN=Mark2 PE=1 SV=1;>sp|Q03141|MARK3_MOUSE MAP/microtubule affinity-regulating kinase 3 OS=Mus musculus OX=10090 GN=Mark3 PE=1 SV=2;>sp|Q05512|MARK2_MOUSE Serine/threonine-protein kinase MARK2 OS=Mus musculus OX=10090 GN=Mark2 PE=1 SV=3;>tr|Q3T9A3|Q3T9A3_MOUSE Isoform of Q05512, Non-specific serine/threonine protein kinase OS=Mus musculus OX=10090 GN=Mark2 PE=1 SV=1;>sp|Q8VHJ5|MARK1_MOUSE Serine/threonine-protein kinase MARK1 OS=Mus musculus OX=10090 GN=Mark1 PE=1 SV=2	MARK2;MARK3;MARK1				13.1096804674705	15.8771595471002	13.9329234094578
Q8K310	>sp|Q8K310|MATR3_MOUSE Matrin-3 OS=Mus musculus OX=10090 GN=Matr3 PE=1 SV=1	MATR3	12.529124332507	12.3206016132217	12.9064881041494			
F6RT34;F6VME3;P04370	>tr|F6RT34|F6RT34_MOUSE Isoform of P04370, Myelin basic protein (Fragment) OS=Mus musculus OX=10090 GN=Mbp PE=1 SV=1;>tr|F6VME3|F6VME3_MOUSE Isoform of P04370, Myelin basic protein (Fragment) OS=Mus musculus OX=10090 GN=Mbp PE=1 SV=1;>sp|P04370|MBP_MOUSE Myelin basic protein OS=Mus musculus OX=10090 GN=Mbp PE=1 SV=2	MBP	16.7550840511739	16.0077970579029	16.1237281653695	16.8367945903832	16.4606242755619	16.9996462643249
Q3UMR5	>sp|Q3UMR5|MCU_MOUSE Calcium uniporter protein, mitochondrial OS=Mus musculus OX=10090 GN=Mcu PE=1 SV=2	MCU	12.9365496061104	14.7638951040413	14.7224215682894			
P08249	>sp|P08249|MDHM_MOUSE Malate dehydrogenase, mitochondrial OS=Mus musculus OX=10090 GN=Mdh2 PE=1 SV=3	MDH2	15.1599148870224	16.0188346945615	15.3296508743131			
E9QP87;Q8VHK5	>tr|E9QP87|E9QP87_MOUSE Isoform of Q8VHK5, Membrane protein MLC1 OS=Mus musculus OX=10090 GN=Mlc1 PE=1 SV=1;>sp|Q8VHK5|MLC1_MOUSE Membrane protein MLC1 OS=Mus musculus OX=10090 GN=Mlc1 PE=1 SV=1	MLC1	15.4420782249779	15.4970118551739	14.1103194050945			
D3YWY6;D3Z5S0;E9Q0V4;P63030	>tr|D3YWY6|D3YWY6_MOUSE Isoform of P63030, Mitochondrial pyruvate carrier OS=Mus musculus OX=10090 GN=Mpc1 PE=1 SV=1;>tr|D3Z5S0|D3Z5S0_MOUSE Isoform of P63030, Mitochondrial pyruvate carrier OS=Mus musculus OX=10090 GN=Mpc1 PE=1 SV=1;>tr|E9Q0V4|E9Q0V4_MOUSE Isoform of P63030, Mitochondrial pyruvate carrier OS=Mus musculus OX=10090 GN=Mpc1 PE=1 SV=1;>sp|P63030|MPC1_MOUSE Mitochondrial pyruvate carrier 1 OS=Mus musculus OX=10090 GN=Mpc1 PE=1 SV=1	MPC1				12.7762844476028	12.6596974680568	13.0228350510436
Q9JLB2	>sp|Q9JLB2|MPP5_MOUSE MAGUK p55 subfamily member 5 OS=Mus musculus OX=10090 GN=Mpp5 PE=1 SV=1	MPP5				12.3863843760453	11.588301294991	10.7004308558122
Q8BK72	>sp|Q8BK72|RT27_MOUSE 28S ribosomal protein S27, mitochondrial OS=Mus musculus OX=10090 GN=Mrps27 PE=1 SV=2	MRPS27				11.4296836251832	11.8704400750428	11.752452825825
P00405	>sp|P00405|COX2_MOUSE Cytochrome c oxidase subunit 2 OS=Mus musculus OX=10090 GN=Mtco2 PE=1 SV=1	MTCO2	15.6579851507632	15.9913292214077	16.3808722181738	16.0980331638896	15.940495537991	16.3315835657802
D3YWC9;F7D291;Q6P9S0	>tr|D3YWC9|D3YWC9_MOUSE Isoform of Q6P9S0, MTSS1-like protein OS=Mus musculus OX=10090 GN=Mtss1l PE=1 SV=1;>tr|F7D291|F7D291_MOUSE Isoform of Q6P9S0, MTSS1-like protein (Fragment) OS=Mus musculus OX=10090 GN=Mtss1l PE=1 SV=1;>sp|Q6P9S0|MTSSL_MOUSE MTSS1-like protein OS=Mus musculus OX=10090 GN=Mtss1l PE=1 SV=1	MTSS1L				9.00343036187902	9.22271788160759	9.03185792161553
A0A1W2P6F6;A0A1W2P7Q9;Q60605	>tr|A0A1W2P6F6|A0A1W2P6F6_MOUSE Isoform of Q60605, Myosin light polypeptide 6 OS=Mus musculus OX=10090 GN=Myl6 PE=1 SV=1;>tr|A0A1W2P7Q9|A0A1W2P7Q9_MOUSE Isoform of Q60605, Myosin light polypeptide 6 OS=Mus musculus OX=10090 GN=Myl6 PE=1 SV=1;>sp|Q60605|MYL6_MOUSE Myosin light polypeptide 6 OS=Mus musculus OX=10090 GN=Myl6 PE=1 SV=3	MYL6	14.7722031582299	14.9427763958277	15.5911553963026	14.701685424572	15.6507629555412	15.2137291732323
B2RRE2;E9QAX2;K3W4L0;Q9JMH9	>tr|B2RRE2|B2RRE2_MOUSE Isoform of Q9JMH9, Myo18a protein OS=Mus musculus OX=10090 GN=Myo18a PE=1 SV=1;>tr|E9QAX2|E9QAX2_MOUSE Isoform of Q9JMH9, Unconventional myosin-XVIIIa OS=Mus musculus OX=10090 GN=Myo18a PE=1 SV=1;>tr|K3W4L0|K3W4L0_MOUSE Isoform of Q9JMH9, Unconventional myosin-XVIIIa OS=Mus musculus OX=10090 GN=Myo18a PE=1 SV=1;>sp|Q9JMH9|MY18A_MOUSE Unconventional myosin-XVIIIa OS=Mus musculus OX=10090 GN=Myo18a PE=1 SV=2	MYO18A	13.6932139395013	13.8916701161179	13.5090097977068	13.2208346277123	13.5083122038133	13.1691186941062
A2AS98;P28660	>tr|A2AS98|A2AS98_MOUSE Isoform of P28660, Nck-associated protein 1 OS=Mus musculus OX=10090 GN=Nckap1 PE=1 SV=1;>sp|P28660|NCKP1_MOUSE Nck-associated protein 1 OS=Mus musculus OX=10090 GN=Nckap1 PE=1 SV=2	NCKAP1	14.0708568238869	14.232855203854	14.115468849766	13.5046339678972	14.0247912920394	13.9766831287956
Q91W39	>sp|Q91W39|NCOA5_MOUSE Nuclear receptor coactivator 5 OS=Mus musculus OX=10090 GN=Ncoa5 PE=1 SV=1	NCOA5	14.2488993564874	14.4279434290474	14.3801786058587	13.742689184692	12.6626909043888	13.8606040276685
Q99LC3	>sp|Q99LC3|NDUAA_MOUSE NADH dehydrogenase [ubiquinone] 1 alpha subcomplex subunit 10, mitochondrial OS=Mus musculus OX=10090 GN=Ndufa10 PE=1 SV=1	NDUFA10				15.0864533332893	16.9693125710617	15.0357728079693
Q9ERS2	>sp|Q9ERS2|NDUAD_MOUSE NADH dehydrogenase [ubiquinone] 1 alpha subcomplex subunit 13 OS=Mus musculus OX=10090 GN=Ndufa13 PE=1 SV=3	NDUFA13	14.8792697048983	14.4348597052149	13.877411583679	14.282147587158	14.2498877523753	14.404265936274
A0A0N4SVQ1;Q62425	>tr|A0A0N4SVQ1|A0A0N4SVQ1_MOUSE Isoform of Q62425, Cytochrome c oxidase subunit NDUFA4 OS=Mus musculus OX=10090 GN=Ndufa4 PE=1 SV=1;>sp|Q62425|NDUA4_MOUSE Cytochrome c oxidase subunit NDUFA4 OS=Mus musculus OX=10090 GN=Ndufa4 PE=1 SV=2	NDUFA4	17.1507479282959	16.5646784526583	16.5988379332221	17.3466938824087	17.2521983476437	17.3512313701414
Q9DCJ5	>sp|Q9DCJ5|NDUA8_MOUSE NADH dehydrogenase [ubiquinone] 1 alpha subcomplex subunit 8 OS=Mus musculus OX=10090 GN=Ndufa8 PE=1 SV=3	NDUFA8	13.7353659692415	13.8565759365856	13.9618371036369	13.3548500859935	13.9045292237865	13.1618973232333
A0A0R4J081;A2AQ17;Q9CWX2	>tr|A0A0R4J081|A0A0R4J081_MOUSE Isoform of Q9CWX2, Complex I intermediate-associated protein 30, mitochondrial OS=Mus musculus OX=10090 GN=Ndufaf1 PE=1 SV=1;>tr|A2AQ17|A2AQ17_MOUSE Isoform of Q9CWX2, Complex I intermediate-associated protein 30, mitochondrial OS=Mus musculus OX=10090 GN=Ndufaf1 PE=1 SV=1;>sp|Q9CWX2|CIA30_MOUSE Complex I intermediate-associated protein 30, mitochondrial OS=Mus musculus OX=10090 GN=Ndufaf1 PE=1 SV=2	NDUFAF1	12.4346297378758	14.2331363423261	13.8599799376173			
Q9JKL4	>sp|Q9JKL4|NDUF3_MOUSE NADH dehydrogenase [ubiquinone] 1 alpha subcomplex assembly factor 3 OS=Mus musculus OX=10090 GN=Ndufaf3 PE=1 SV=1	NDUFAF3	15.9720204084115	15.8548788836949	15.7594172055352	15.8374753494521	15.3568310335917	15.3335362448745
Q9D1H6	>sp|Q9D1H6|NDUF4_MOUSE NADH dehydrogenase [ubiquinone] 1 alpha subcomplex assembly factor 4 OS=Mus musculus OX=10090 GN=Ndufaf4 PE=1 SV=1	NDUFAF4	14.7758602347601	14.969582857767	14.4507104342974	14.4859595540685	15.0965665984642	14.6639026138037
Q9DCS9	>sp|Q9DCS9|NDUBA_MOUSE NADH dehydrogenase [ubiquinone] 1 beta subcomplex subunit 10 OS=Mus musculus OX=10090 GN=Ndufb10 PE=1 SV=3	NDUFB10	15.2572416949014	14.0702359654016	14.6459815542504			
Q91VD9	>sp|Q91VD9|NDUS1_MOUSE NADH-ubiquinone oxidoreductase 75 kDa subunit, mitochondrial OS=Mus musculus OX=10090 GN=Ndufs1 PE=1 SV=2	NDUFS1	14.4226723539505	14.4611205765722	13.7488239643197	14.0376155402011	14.0714016388894	13.8648313837761
D3YXT0;Q91WD5	>tr|D3YXT0|D3YXT0_MOUSE Isoform of Q91WD5, NADH dehydrogenase [ubiquinone] iron-sulfur protein 2, mitochondrial OS=Mus musculus OX=10090 GN=Ndufs2 PE=1 SV=1;>sp|Q91WD5|NDUS2_MOUSE NADH dehydrogenase [ubiquinone] iron-sulfur protein 2, mitochondrial OS=Mus musculus OX=10090 GN=Ndufs2 PE=1 SV=1	NDUFS2	14.6831405922137	15.3396790966162	12.7136150861066	14.1060458182211	12.7701125359916	13.0352250741962
Q9DCT2	>sp|Q9DCT2|NDUS3_MOUSE NADH dehydrogenase [ubiquinone] iron-sulfur protein 3, mitochondrial OS=Mus musculus OX=10090 GN=Ndufs3 PE=1 SV=2	NDUFS3	13.4183594076441	14.5269552247158	13.7332516211351	14.7186193817161	13.7307537251266	14.832612392994
Q9DC70	>sp|Q9DC70|NDUS7_MOUSE NADH dehydrogenase [ubiquinone] iron-sulfur protein 7, mitochondrial OS=Mus musculus OX=10090 GN=Ndufs7 PE=1 SV=1	NDUFS7				11.363613476034	13.6019628069407	13.8420464203714
P46935	>sp|P46935|NEDD4_MOUSE E3 ubiquitin-protein ligase NEDD4 OS=Mus musculus OX=10090 GN=Nedd4 PE=1 SV=3	NEDD4				13.8662919181876	14.157330778341	14.7931438700375
E9PXB7;Q8CFI0	>tr|E9PXB7|E9PXB7_MOUSE Isoform of Q8CFI0, E3 ubiquitin-protein ligase NEDD4-like OS=Mus musculus OX=10090 GN=Nedd4l PE=1 SV=1;>sp|Q8CFI0|NED4L_MOUSE E3 ubiquitin-protein ligase NEDD4-like OS=Mus musculus OX=10090 GN=Nedd4l PE=1 SV=2	NEDD4L				14.0411521961358	14.2419250700713	14.14954266737
A0A4W9;D3Z4T6;Q80Z24	>tr|A0A4W9|A0A4W9_MOUSE Isoform of Q80Z24, Neuronal growth regulator 1 OS=Mus musculus OX=10090 GN=Negr1 PE=1 SV=1;>tr|D3Z4T6|D3Z4T6_MOUSE Isoform of Q80Z24, Neuronal growth regulator 1 OS=Mus musculus OX=10090 GN=Negr1 PE=1 SV=1;>sp|Q80Z24|NEGR1_MOUSE Neuronal growth regulator 1 OS=Mus musculus OX=10090 GN=Negr1 PE=1 SV=1	NEGR1	14.460867117414	14.3617520316325	13.4421625443965			
O55125	>sp|O55125|NIPS1_MOUSE Protein NipSnap homolog 1 OS=Mus musculus OX=10090 GN=Nipsnap1 PE=1 SV=1	NIPSNAP1	14.3144814187442	12.2535842351391	13.7464167308915	12.9890123738808	12.5008771072458	14.9157832141705
O55126;Q7TMG8	>sp|O55126|NIPS2_MOUSE Protein NipSnap homolog 2 OS=Mus musculus OX=10090 GN=Nipsnap2 PE=1 SV=1;>tr|Q7TMG8|Q7TMG8_MOUSE Isoform of O55126, Glioblastoma amplified sequence OS=Mus musculus OX=10090 GN=Nipsnap2 PE=1 SV=1	NIPSNAP2	15.7684809761678	15.1334966974389	14.6319343956775	15.3567591505583	14.3790396949628	15.3574129122531
Q69ZK9	>sp|Q69ZK9|NLGN2_MOUSE Neuroligin-2 OS=Mus musculus OX=10090 GN=Nlgn2 PE=1 SV=2	NLGN2	17.285217829625	17.4680924885971	17.203137383354	16.3601923013927	17.4069681312339	17.029979989173
A2AGI0;A2AGI2;Q8BYM5	>tr|A2AGI0|A2AGI0_MOUSE Isoform of Q8BYM5, Neuroligin-3 (Fragment) OS=Mus musculus OX=10090 GN=Nlgn3 PE=1 SV=1;>tr|A2AGI2|A2AGI2_MOUSE Isoform of Q8BYM5, Neuroligin-3 OS=Mus musculus OX=10090 GN=Nlgn3 PE=1 SV=1;>sp|Q8BYM5|NLGN3_MOUSE Neuroligin-3 OS=Mus musculus OX=10090 GN=Nlgn3 PE=1 SV=2	NLGN3	13.191317295075	13.1680162332563	12.2430824332891	13.4666955494434	13.6919511923888	13.2105356648322
Q99K48	>sp|Q99K48|NONO_MOUSE Non-POU domain-containing octamer-binding protein OS=Mus musculus OX=10090 GN=Nono PE=1 SV=3	NONO	16.6348806565205	15.7474278177868	16.4399825121738			
F8WGF2;Q9Z0J4;S4R255	>tr|F8WGF2|F8WGF2_MOUSE Isoform of Q9Z0J4, Nitric oxide synthase, brain OS=Mus musculus OX=10090 GN=Nos1 PE=1 SV=1;>sp|Q9Z0J4|NOS1_MOUSE Nitric oxide synthase, brain OS=Mus musculus OX=10090 GN=Nos1 PE=1 SV=1;>tr|S4R255|S4R255_MOUSE Isoform of Q9Z0J4, Nitric oxide synthase OS=Mus musculus OX=10090 GN=Nos1 PE=1 SV=1	NOS1	14.4688071336483	14.5142061226569	14.5518413316909	14.1101640472187	14.0599759135348	14.0095208348881
Q9D3A8	>sp|Q9D3A8|CAPON_MOUSE Carboxyl-terminal PDZ ligand of neuronal nitric oxide synthase protein OS=Mus musculus OX=10090 GN=Nos1ap PE=1 SV=3	NOS1AP	12.9389893301498	12.8968904211465	12.5893618213807	13.0060655281218	12.3300422053681	13.4225483608358
E9Q039;F6QYF8;Q11011	>tr|E9Q039|E9Q039_MOUSE Isoform of Q11011, Aminopeptidase OS=Mus musculus OX=10090 GN=Npepps PE=1 SV=1;>tr|F6QYF8|F6QYF8_MOUSE Isoform of Q11011, Aminopeptidase (Fragment) OS=Mus musculus OX=10090 GN=Npepps PE=1 SV=1;>sp|Q11011|PSA_MOUSE Puromycin-sensitive aminopeptidase OS=Mus musculus OX=10090 GN=Npepps PE=1 SV=2	NPEPPS				13.6719425322926	15.1761856568878	14.8830356159575
P97300	>sp|P97300|NPTN_MOUSE Neuroplastin OS=Mus musculus OX=10090 GN=Nptn PE=1 SV=3	NPTN				14.4693730483831	15.3853089828955	14.1638196446385
E0CY11;Q9CS84	>tr|E0CY11|E0CY11_MOUSE Isoform of Q9CS84, Neurexin-1 OS=Mus musculus OX=10090 GN=Nrxn1 PE=1 SV=2;>sp|Q9CS84|NRX1A_MOUSE Neurexin-1 OS=Mus musculus OX=10090 GN=Nrxn1 PE=1 SV=3	NRXN1				12.710140514066	13.0411251274116	13.0112210010814
P46460	>sp|P46460|NSF_MOUSE Vesicle-fusing ATPase OS=Mus musculus OX=10090 GN=Nsf PE=1 SV=2	NSF	14.3301433539695	14.1876869905984	14.241164746202	14.5721529379641	14.4636599607594	14.391497142367
A0A0R4J1I6;Q9QY81	>tr|A0A0R4J1I6|A0A0R4J1I6_MOUSE Isoform of Q9QY81, Nuclear pore membrane glycoprotein 210 OS=Mus musculus OX=10090 GN=Nup210 PE=1 SV=1;>sp|Q9QY81|PO210_MOUSE Nuclear pore membrane glycoprotein 210 OS=Mus musculus OX=10090 GN=Nup210 PE=1 SV=2	NUP210	13.186444078793	13.6770396751821	13.6572848067297	13.0360724711421	12.5896816628589	13.184118859066
Q60597	>sp|Q60597|ODO1_MOUSE 2-oxoglutarate dehydrogenase, mitochondrial OS=Mus musculus OX=10090 GN=Ogdh PE=1 SV=3	OGDH	14.2649559029275	13.9408054934955	13.9208149749604	13.9759128249045	14.0058694483076	13.9094646441428
B2RXT3	>tr|B2RXT3|B2RXT3_MOUSE Isoform of E9Q7L0, Ogdhl protein OS=Mus musculus OX=10090 GN=Ogdhl PE=1 SV=1	OGDHL	14.0290061172078	13.9436009104641	13.4524880470901	13.9897468577799	14.0824874121412	14.0483911609841
A3KGE4;G3X9Q7;O88998;Q8R357	>tr|A3KGE4|A3KGE4_MOUSE Isoform of O88998, Noelin OS=Mus musculus OX=10090 GN=Olfm1 PE=1 SV=1;>tr|G3X9Q7|G3X9Q7_MOUSE Isoform of O88998, Noelin OS=Mus musculus OX=10090 GN=Olfm1 PE=1 SV=1;>sp|O88998|NOE1_MOUSE Noelin OS=Mus musculus OX=10090 GN=Olfm1 PE=1 SV=1;>tr|Q8R357|Q8R357_MOUSE Isoform of O88998, Noelin OS=Mus musculus OX=10090 GN=Olfm1 PE=1 SV=1	OLFM1	12.5769096481327	13.4203413817424	13.7175447446136			
Q8BXR9;V9GXX3	>sp|Q8BXR9|OSBL6_MOUSE Oxysterol-binding protein-related protein 6 OS=Mus musculus OX=10090 GN=Osbpl6 PE=1 SV=1;>tr|V9GXX3|V9GXX3_MOUSE Isoform of Q8BXR9, Oxysterol-binding protein (Fragment) OS=Mus musculus OX=10090 GN=Osbpl6 PE=1 SV=1	OSBPL6	11.1743809885289	12.1261875473487	10.7975122347662			
Q9JIP4	>sp|Q9JIP4|PANX1_MOUSE Pannexin-1 OS=Mus musculus OX=10090 GN=Panx1 PE=1 SV=3	PANX1	15.5391578333133	15.1675604607233	15.6170621195963	14.7564244925898	15.1667887526188	14.852352049992
P60335;Q61990	>sp|P60335|PCBP1_MOUSE Poly(rC)-binding protein 1 OS=Mus musculus OX=10090 GN=Pcbp1 PE=1 SV=1;>sp|Q61990|PCBP2_MOUSE Poly(rC)-binding protein 2 OS=Mus musculus OX=10090 GN=Pcbp2 PE=1 SV=1	PCBP1;PCBP2	12.8977497978298	12.9985928865341	13.5649512317657			
