protein_id	fasta_headers	gene_symbols_or_id	KO_1	KO_2	KO_3	WT_1	WT_2	WT_3
Q9CPN9	>tr|Q9CPN9|Q9CPN9_MOUSE RIKEN cDNA 2210010C04 gene OS=Mus musculus OX=10090 GN=2210010C04Rik PE=1 SV=1	2210010C04RIK	15.8054582348164	15.7730891801639	15.353501100783			
B7ZCU0;B7ZCU2;B7ZCU3;B7ZCU4;B7ZCU5;J3QNK8;Q8CBW3	>tr|B7ZCU0|B7ZCU0_MOUSE Isoform of Q8CBW3, Abl interactor 1 OS=Mus musculus OX=10090 GN=Abi1 PE=1 SV=1;>tr|B7ZCU2|B7ZCU2_MOUSE Isoform of Q8CBW3, Abl interactor 1 OS=Mus musculus OX=10090 GN=Abi1 PE=1 SV=1;>tr|B7ZCU3|B7ZCU3_MOUSE Isoform of Q8CBW3, Abl interactor 1 OS=Mus musculus OX=10090 GN=Abi1 PE=1 SV=1;>tr|B7ZCU4|B7ZCU4_MOUSE Isoform of Q8CBW3, Abl interactor 1 OS=Mus musculus OX=10090 GN=Abi1 PE=1 SV=1;>tr|B7ZCU5|B7ZCU5_MOUSE Isoform of Q8CBW3, Abl interactor 1 OS=Mus musculus OX=10090 GN=Abi1 PE=1 SV=1;>tr|J3QNK8|J3QNK8_MOUSE Isoform of Q8CBW3, Abl interactor 1 OS=Mus musculus OX=10090 GN=Abi1 PE=1 SV=1;>sp|Q8CBW3|ABI1_MOUSE Abl interactor 1 OS=Mus musculus OX=10090 GN=Abi1 PE=1 SV=3	ABI1				12.7274076284562	12.9123992811284	12.9731489881324
A0A0R4J083;P51174	>tr|A0A0R4J083|A0A0R4J083_MOUSE Isoform of P51174, Long-chain-specific acyl-CoA dehydrogenase, mitochondrial OS=Mus musculus OX=10090 GN=Acadl PE=1 SV=1;>sp|P51174|ACADL_MOUSE Long-chain specific acyl-CoA dehydrogenase, mitochondrial OS=Mus musculus OX=10090 GN=Acadl PE=1 SV=2	ACADL	15.1001520325053	14.5542454229453	13.6518073563135	12.6943973278322	14.8708240157659	14.4344903139133
B1AR28;P50544	>tr|B1AR28|B1AR28_MOUSE Isoform of P50544, Very long-chain-specific acyl-CoA dehydrogenase, mitochondrial OS=Mus musculus OX=10090 GN=Acadvl PE=1 SV=1;>sp|P50544|ACADV_MOUSE Very long-chain specific acyl-CoA dehydrogenase, mitochondrial OS=Mus musculus OX=10090 GN=Acadvl PE=1 SV=3	ACADVL				14.1007675684999	13.9877349269721	14.4488309596131
Q6NXL5	>tr|Q6NXL5|Q6NXL5_MOUSE ArfGAP with coiled-coil, ankyrin repeat and PH domains 3 OS=Mus musculus OX=10090 GN=Acap3 PE=1 SV=1	ACAP3	14.0461351718703	13.8779768449168	13.7601859527336			
Q3V117;Q91V92	>tr|Q3V117|Q3V117_MOUSE Isoform of Q91V92, ATP-citrate synthase OS=Mus musculus OX=10090 GN=Acly PE=1 SV=1;>sp|Q91V92|ACLY_MOUSE ATP-citrate synthase OS=Mus musculus OX=10090 GN=Acly PE=1 SV=1	ACLY	13.4995459777539	14.3025247513952	14.1089045885509			
Q99KI0	>sp|Q99KI0|ACON_MOUSE Aconitate hydratase, mitochondrial OS=Mus musculus OX=10090 GN=Aco2 PE=1 SV=1	ACO2	14.2544290772009	13.8395434738768	13.9382125524452	14.6019571706147	14.3933930364038	14.255615065953
Q9CQR4	>sp|Q9CQR4|ACO13_MOUSE Acyl-coenzyme A thioesterase 13 OS=Mus musculus OX=10090 GN=Acot13 PE=1 SV=1	ACOT13	17.6003922691944	17.2579933858069	17.1957355213957	17.6347025602831	17.4420303619655	17.248740226427
Q9R0X4	>sp|Q9R0X4|ACOT9_MOUSE Acyl-coenzyme A thioesterase 9, mitochondrial OS=Mus musculus OX=10090 GN=Acot9 PE=1 SV=1	ACOT9	13.0635111321189	13.0406465469311	11.7725013863604	13.6913630075361	13.4547304713319	13.1263930163024
Q99PU5	>sp|Q99PU5|ACBG1_MOUSE Long-chain-fatty-acid--CoA ligase ACSBG1 OS=Mus musculus OX=10090 GN=Acsbg1 PE=1 SV=1	ACSBG1				13.2275755993	14.0501336335326	13.0752400849023
P62737;P63268;P68033	>sp|P62737|ACTA_MOUSE Actin, aortic smooth muscle OS=Mus musculus OX=10090 GN=Acta2 PE=1 SV=1;>sp|P63268|ACTH_MOUSE Actin, gamma-enteric smooth muscle OS=Mus musculus OX=10090 GN=Actg2 PE=1 SV=1;>sp|P68033|ACTC_MOUSE Actin, alpha cardiac muscle 1 OS=Mus musculus OX=10090 GN=Actc1 PE=1 SV=1	ACTA2;ACTG2;ACTC1	14.3550540566127	14.0990101955712	15.2727694739013			
P60710;P63260	>sp|P60710|ACTB_MOUSE Actin, cytoplasmic 1 OS=Mus musculus OX=10090 GN=Actb PE=1 SV=1;>sp|P63260|ACTG_MOUSE Actin, cytoplasmic 2 OS=Mus musculus OX=10090 GN=Actg1 PE=1 SV=1	ACTB;ACTG1	16.7051567625028	16.966962085313	16.9188209159757	17.0764331626309	17.0888932518875	17.1375554902837
D3YUP9;Q9R1V6	>tr|D3YUP9|D3YUP9_MOUSE Isoform of Q9R1V6, Disintegrin and metalloproteinase domain-containing protein 22 OS=Mus musculus OX=10090 GN=Adam22 PE=1 SV=1;>sp|Q9R1V6|ADA22_MOUSE Disintegrin and metalloproteinase domain-containing protein 22 OS=Mus musculus OX=10090 GN=Adam22 PE=1 SV=2	ADAM22				13.6457175872681	13.0629643839744	13.0650462567347
Q9QYB5	>sp|Q9QYB5|ADDG_MOUSE Gamma-adducin OS=Mus musculus OX=10090 GN=Add3 PE=1 SV=2	ADD3				14.1685031199419	13.3422862746014	14.3654696818332
A0A0G2JGI9;F8VPN4	>tr|A0A0G2JGI9|A0A0G2JGI9_MOUSE Isoform of F8VPN4, Amylo-1,6-glucosidase, 4-alpha-glucanotransferase OS=Mus musculus OX=10090 GN=Agl PE=1 SV=1;>tr|F8VPN4|F8VPN4_MOUSE Amylo-1,6-glucosidase, 4-alpha-glucanotransferase OS=Mus musculus OX=10090 GN=Agl PE=1 SV=1	AGL				12.7360069859982	13.5004629917229	12.7363435080885
Q80SW1	>sp|Q80SW1|SAHH2_MOUSE S-adenosylhomocysteine hydrolase-like protein 1 OS=Mus musculus OX=10090 GN=Ahcyl1 PE=1 SV=1	AHCYL1	15.7325417163745	14.6625206030602	14.2648834694981	15.7267677451794	15.2128593223311	15.698490088173
B1AU25;Q9Z0X1	>tr|B1AU25|B1AU25_MOUSE Isoform of Q9Z0X1, Apoptosis-inducing factor 1, mitochondrial OS=Mus musculus OX=10090 GN=Aifm1 PE=1 SV=1;>sp|Q9Z0X1|AIFM1_MOUSE Apoptosis-inducing factor 1, mitochondrial OS=Mus musculus OX=10090 GN=Aifm1 PE=1 SV=1	AIFM1	12.7221705102664	12.4875068966066	14.8294420236918	14.4947849591268	13.7193675791016	13.9554560726746
P07724	>sp|P07724|ALBU_MOUSE Serum albumin OS=Mus musculus OX=10090 GN=Alb PE=1 SV=3	ALB	13.6472580602429	14.1777114854855	14.6124110771944	14.591119093061	14.0340783529582	14.0558742373986
A0A0N4SW56;Q8R0Y6	>tr|A0A0N4SW56|A0A0N4SW56_MOUSE Isoform of Q8R0Y6, Cytosolic 10-formyltetrahydrofolate dehydrogenase OS=Mus musculus OX=10090 GN=Aldh1l1 PE=1 SV=1;>sp|Q8R0Y6|AL1L1_MOUSE Cytosolic 10-formyltetrahydrofolate dehydrogenase OS=Mus musculus OX=10090 GN=Aldh1l1 PE=1 SV=1	ALDH1L1				13.7674554502875	13.6638465450019	13.0069881728341
Q920R0	>sp|Q920R0|ALS2_MOUSE Alsin OS=Mus musculus OX=10090 GN=Als2 PE=1 SV=3	ALS2	14.2933236941847	14.1909030760376	14.2996602818596	14.1314940298208	14.6649232872563	14.163425882293
A2AE27	>tr|A2AE27|A2AE27_MOUSE Isoform of Q9DBT5, AMP deaminase OS=Mus musculus OX=10090 GN=Ampd2 PE=1 SV=1	AMPD2	14.0376673108135	13.9875499734268	14.0077200703105	13.8986908099273	13.9530159595091	13.6690983139918
B1AT59;B1AT60;Q400C8	>tr|B1AT59|B1AT59_MOUSE Isoform of Q400C8, Archaemetzincin-2 OS=Mus musculus OX=10090 GN=Amz2 PE=1 SV=1;>tr|B1AT60|B1AT60_MOUSE Isoform of Q400C8, Archaemetzincin-2 OS=Mus musculus OX=10090 GN=Amz2 PE=1 SV=1;>sp|Q400C8|AMZ2_MOUSE Archaemetzincin-2 OS=Mus musculus OX=10090 GN=Amz2 PE=2 SV=1	AMZ2	13.116411484519	12.9434929122078	13.21298457613			
A0A0R4J1N7;D3Z5M4;Q02357	>tr|A0A0R4J1N7|A0A0R4J1N7_MOUSE Isoform of Q02357, Ankyrin-1 OS=Mus musculus OX=10090 GN=Ank1 PE=1 SV=1;>tr|D3Z5M4|D3Z5M4_MOUSE Isoform of Q02357, Ankyrin-1 OS=Mus musculus OX=10090 GN=Ank1 PE=1 SV=1;>sp|Q02357|ANK1_MOUSE Ankyrin-1 OS=Mus musculus OX=10090 GN=Ank1 PE=1 SV=2	ANK1	11.8870916116274	12.1411153337216	12.2871378265457	13.4306383154201	13.1287376677552	13.3656450402064
P17426	>sp|P17426|AP2A1_MOUSE AP-2 complex subunit alpha-1 OS=Mus musculus OX=10090 GN=Ap2a1 PE=1 SV=1	AP2A1	12.8419203158017	13.1009523123445	13.5298644742056	13.6974650079766	13.740347088695	13.135635371751
P17427	>sp|P17427|AP2A2_MOUSE AP-2 complex subunit alpha-2 OS=Mus musculus OX=10090 GN=Ap2a2 PE=1 SV=2	AP2A2	13.7581464114905	13.9228199396675	13.9615264449979	13.3768350444885	12.5463152783558	13.3348182926214
H3BKM0;Q9DBG3	>tr|H3BKM0|H3BKM0_MOUSE Isoform of Q9DBG3, AP complex subunit beta OS=Mus musculus OX=10090 GN=Ap2b1 PE=1 SV=1;>sp|Q9DBG3|AP2B1_MOUSE AP-2 complex subunit beta OS=Mus musculus OX=10090 GN=Ap2b1 PE=1 SV=1	AP2B1	16.9651671345627	16.6133101748955	17.0366894305601	11.7581331149146	15.0766182359978	12.3124842167024
P61205;P84078	>sp|P61205|ARF3_MOUSE ADP-ribosylation factor 3 OS=Mus musculus OX=10090 GN=Arf3 PE=2 SV=2;>sp|P84078|ARF1_MOUSE ADP-ribosylation factor 1 OS=Mus musculus OX=10090 GN=Arf1 PE=1 SV=2	ARF3;ARF1				13.5549121525261	14.0886528885939	13.5258396036827
Q8BW86	>sp|Q8BW86|ARG33_MOUSE Rho guanine nucleotide exchange factor 33 OS=Mus musculus OX=10090 GN=Arhgef33 PE=1 SV=3	ARHGEF33				13.3789107155193	12.4234687965919	12.924070778034
A0A0R4J0X8;D3Z0V2;Q9ES28	>tr|A0A0R4J0X8|A0A0R4J0X8_MOUSE Isoform of Q9ES28, Rho guanine nucleotide exchange factor (GEF7), isoform CRA_a OS=Mus musculus OX=10090 GN=Arhgef7 PE=1 SV=1;>tr|D3Z0V2|D3Z0V2_MOUSE Isoform of Q9ES28, Rho guanine nucleotide exchange factor 7 (Fragment) OS=Mus musculus OX=10090 GN=Arhgef7 PE=1 SV=2;>sp|Q9ES28|ARHG7_MOUSE Rho guanine nucleotide exchange factor 7 OS=Mus musculus OX=10090 GN=Arhgef7 PE=1 SV=2	ARHGEF7				15.5692239728961	13.8450525339757	13.3697059129579
Q8C0M9	>sp|Q8C0M9|ASGL1_MOUSE Isoaspartyl peptidase/L-asparaginase OS=Mus musculus OX=10090 GN=Asrgl1 PE=1 SV=1	ASRGL1	13.8472112201853	14.0551407356636	14.0841870843348			
Q925I1	>sp|Q925I1|ATAD3_MOUSE ATPase family AAA domain-containing protein 3 OS=Mus musculus OX=10090 GN=Atad3 PE=1 SV=1	ATAD3	13.748572155257	13.7813265791877	14.6562570225204	14.968328146291	12.8918469081798	13.9740801636888
Q8VDN2	>sp|Q8VDN2|AT1A1_MOUSE Sodium/potassium-transporting ATPase subunit alpha-1 OS=Mus musculus OX=10090 GN=Atp1a1 PE=1 SV=1	ATP1A1	15.1472043410641	15.4310371507295	15.0813559316461	15.6383876020022	15.6701578287665	15.7065820204266
D3YYN7;Q6PIE5	>tr|D3YYN7|D3YYN7_MOUSE Isoform of Q6PIE5, Sodium/potassium-transporting ATPase subunit alpha OS=Mus musculus OX=10090 GN=Atp1a2 PE=1 SV=1;>sp|Q6PIE5|AT1A2_MOUSE Sodium/potassium-transporting ATPase subunit alpha-2 OS=Mus musculus OX=10090 GN=Atp1a2 PE=1 SV=1	ATP1A2	13.3462539827985	12.7325964362983	13.0251060748369	13.1070574463274	13.1706637130475	12.9097546483418
A0A0G2JGX4;Q6PIC6	>tr|A0A0G2JGX4|A0A0G2JGX4_MOUSE Isoform of Q6PIC6, Sodium/potassium-transporting ATPase subunit alpha OS=Mus musculus OX=10090 GN=Atp1a3 PE=1 SV=1;>sp|Q6PIC6|AT1A3_MOUSE Sodium/potassium-transporting ATPase subunit alpha-3 OS=Mus musculus OX=10090 GN=Atp1a3 PE=1 SV=1	ATP1A3	15.6992127797919	15.7210994278079	15.6144333512455	16.4849262242832	16.1956034856603	16.4225545190711
P14094	>sp|P14094|AT1B1_MOUSE Sodium/potassium-transporting ATPase subunit beta-1 OS=Mus musculus OX=10090 GN=Atp1b1 PE=1 SV=1	ATP1B1	16.0033284464757	15.9664171963753	15.4976840360093	16.2289056868231	15.991112060406	16.261950162612
I7HIF3;P14231	>tr|I7HIF3|I7HIF3_MOUSE Isoform of P14231, ATPase, Na+/K+ transporting, beta 2 polypeptide (Fragment) OS=Mus musculus OX=10090 GN=Atp1b2 PE=1 SV=1;>sp|P14231|AT1B2_MOUSE Sodium/potassium-transporting ATPase subunit beta-2 OS=Mus musculus OX=10090 GN=Atp1b2 PE=1 SV=2	ATP1B2	14.0900311911181	13.6703802995552	14.2029989769252			
P97370	>sp|P97370|AT1B3_MOUSE Sodium/potassium-transporting ATPase subunit beta-3 OS=Mus musculus OX=10090 GN=Atp1b3 PE=1 SV=1	ATP1B3				14.353332123435	14.8433348448679	13.1104243213733
O55143	>sp|O55143|AT2A2_MOUSE Sarcoplasmic/endoplasmic reticulum calcium ATPase 2 OS=Mus musculus OX=10090 GN=Atp2a2 PE=1 SV=2	ATP2A2	13.7018229617443	13.6470682029633	13.6919191691961	13.6189854414691	13.852605015311	13.6977391177607
A0A1W2P772	>tr|A0A1W2P772|A0A1W2P772_MOUSE Isoform of G5E829, Plasma membrane calcium-transporting ATPase 1 (Fragment) OS=Mus musculus OX=10090 GN=Atp2b1 PE=1 SV=1	ATP2B1	13.9852099189446	12.273492056411	15.5032746318965	14.5221412561439	15.580295984633	14.7350191265355
G5E829	>sp|G5E829|AT2B1_MOUSE Plasma membrane calcium-transporting ATPase 1 OS=Mus musculus OX=10090 GN=Atp2b1 PE=1 SV=1	ATP2B1	14.3599731269349	14.1481789037269	13.975788308043	13.1030117687173	13.1037611870195	12.4107402176191
F8WHB1;Q3UHH0;Q9R0K7	>tr|F8WHB1|F8WHB1_MOUSE Isoform of Q9R0K7, Calcium-transporting ATPase OS=Mus musculus OX=10090 GN=Atp2b2 PE=1 SV=1;>tr|Q3UHH0|Q3UHH0_MOUSE Isoform of Q9R0K7, Calcium-transporting ATPase OS=Mus musculus OX=10090 GN=Atp2b2 PE=1 SV=1;>sp|Q9R0K7|AT2B2_MOUSE Plasma membrane calcium-transporting ATPase 2 OS=Mus musculus OX=10090 GN=Atp2b2 PE=1 SV=2	ATP2B2	13.6623675567449	13.7778564125198	13.0816907018316	14.5410955660127	14.2588582513051	14.5502483692518
S4R1C4	>tr|S4R1C4|S4R1C4_MOUSE Isoform of Q9R0K7, Calcium-transporting ATPase OS=Mus musculus OX=10090 GN=Atp2b2 PE=1 SV=1	ATP2B2	14.1221166011821	13.6337830089887	14.0796251801902	12.6911071512142	12.7426179494873	13.9610450498461
A2ALL9	>tr|A2ALL9|A2ALL9_MOUSE Isoform of Q0VF55, Calcium-transporting ATPase OS=Mus musculus OX=10090 GN=Atp2b3 PE=1 SV=1	ATP2B3	14.1219611619351	13.8740762733594	13.9481231174753	14.1869053610952	13.761594045092	14.0774708463489
Q8C2Q8;Q91VR2	>tr|Q8C2Q8|Q8C2Q8_MOUSE Isoform of Q91VR2, ATP synthase subunit gamma OS=Mus musculus OX=10090 GN=Atp5c1 PE=1 SV=1;>sp|Q91VR2|ATPG_MOUSE ATP synthase subunit gamma, mitochondrial OS=Mus musculus OX=10090 GN=Atp5f1c PE=1 SV=1	ATP5C1;ATP5F1C	15.4909894006077	15.7752531800798	15.7491987525578	15.999798722681	16.0251570235184	15.8857512269479
Q9CQQ7	>sp|Q9CQQ7|AT5F1_MOUSE ATP synthase F(0) complex subunit B1, mitochondrial OS=Mus musculus OX=10090 GN=Atp5f1 PE=1 SV=1	ATP5F1	15.0858009000057	14.8167708214014	14.5397121416502	15.6104275297309	15.9455877031812	15.3018277317775
Q03265	>sp|Q03265|ATPA_MOUSE ATP synthase subunit alpha, mitochondrial OS=Mus musculus OX=10090 GN=Atp5f1a PE=1 SV=1	ATP5F1A	16.8738235077117	16.9646846174137	16.5459367904971	16.8661047991983	16.9976082574853	16.7152309901988
P56480	>sp|P56480|ATPB_MOUSE ATP synthase subunit beta, mitochondrial OS=Mus musculus OX=10090 GN=Atp5f1b PE=1 SV=2	ATP5F1B	16.2525949413904	16.0436602608405	16.1892669973597	16.1429057328619	16.0941072495814	15.8149335880849
Q9DCX2	>sp|Q9DCX2|ATP5H_MOUSE ATP synthase subunit d, mitochondrial OS=Mus musculus OX=10090 GN=Atp5h PE=1 SV=3	ATP5H	14.3576589134165	14.2800937138231	14.5664973057528	14.6854428789058	14.8003557416425	14.696767286219
Q06185	>sp|Q06185|ATP5I_MOUSE ATP synthase subunit e, mitochondrial OS=Mus musculus OX=10090 GN=Atp5i PE=1 SV=2	ATP5I	16.0631497499971	18.1736756507259	18.7073873691109	16.3611622436976	16.5434756815479	16.1452163481821
F8WHP8;P56135	>tr|F8WHP8|F8WHP8_MOUSE Isoform of P56135, ATP synthase subunit f, mitochondrial OS=Mus musculus OX=10090 GN=Atp5j2 PE=1 SV=1;>sp|P56135|ATPK_MOUSE ATP synthase subunit f, mitochondrial OS=Mus musculus OX=10090 GN=Atp5j2 PE=1 SV=3	ATP5J2	15.683182751715	15.947527290624	15.5074826724814	15.8163906669274	12.915575381316	12.1142062192135
Q9CPQ8	>sp|Q9CPQ8|ATP5L_MOUSE ATP synthase subunit g, mitochondrial OS=Mus musculus OX=10090 GN=Atp5l PE=1 SV=1	ATP5L	13.5494611531718	14.2016584210607	13.175588705418	14.0385622658565	13.9823061212461	13.4618891109747
Q9DB20	>sp|Q9DB20|ATPO_MOUSE ATP synthase subunit O, mitochondrial OS=Mus musculus OX=10090 GN=Atp5o PE=1 SV=1	ATP5O	15.5977480434455	15.6794254756693	15.8449926059509	16.6754495192221	16.0113069013496	16.1756705071337
P50516	>sp|P50516|VATA_MOUSE V-type proton ATPase catalytic subunit A OS=Mus musculus OX=10090 GN=Atp6v1a PE=1 SV=2	ATP6V1A				13.9169539281671	12.9692501089387	13.1863019026953
A2AGL5;Q9D9K3	>tr|A2AGL5|A2AGL5_MOUSE Isoform of Q9D9K3, Apoptosis, caspase activation inhibitor, isoform CRA_c OS=Mus musculus OX=10090 GN=Aven PE=1 SV=1;>sp|Q9D9K3|AVEN_MOUSE Cell death regulator Aven OS=Mus musculus OX=10090 GN=Aven PE=1 SV=2	AVEN	16.5535720072242	14.6234325877092	17.1499357366834			
Q80XN0	>sp|Q80XN0|BDH_MOUSE D-beta-hydroxybutyrate dehydrogenase, mitochondrial OS=Mus musculus OX=10090 GN=Bdh1 PE=1 SV=2	BDH1				14.907365722152	14.2719417740898	14.5588692572742
Q5RJI5	>sp|Q5RJI5|BRSK1_MOUSE Serine/threonine-protein kinase BRSK1 OS=Mus musculus OX=10090 GN=Brsk1 PE=1 SV=1	BRSK1				13.6505628892876	12.9912756507775	12.5422303667963
P98086	>sp|P98086|C1QA_MOUSE Complement C1q subcomponent subunit A OS=Mus musculus OX=10090 GN=C1qa PE=1 SV=2	C1QA	16.9464652426631	16.4857978215635	16.6183778824918	16.3190984513726	16.5170983564344	16.0391608987992
P14106	>sp|P14106|C1QB_MOUSE Complement C1q subcomponent subunit B OS=Mus musculus OX=10090 GN=C1qb PE=1 SV=2	C1QB	15.582828253004	16.2102570841468	15.7804860762078	15.4646670164057	14.8688071434807	15.3198092539846
Q02105	>sp|Q02105|C1QC_MOUSE Complement C1q subcomponent subunit C OS=Mus musculus OX=10090 GN=C1qc PE=1 SV=2	C1QC	16.7510670632557	16.3736649641311	16.5629469739726	16.0706228488826	16.7543143097366	16.3125873597882
E9Q6C2;Q8CG14	>tr|E9Q6C2|E9Q6C2_MOUSE Isoform of Q8CG14, Complement component 1, s subcomponent 1 OS=Mus musculus OX=10090 GN=C1s1 PE=1 SV=1;>sp|Q8CG14|CS1A_MOUSE Complement C1s-A subcomponent OS=Mus musculus OX=10090 GN=C1sa PE=2 SV=2	C1S1;C1SA	12.8228379244178	12.5067653263408	13.4427816529302	11.6971855138962	15.1066044355966	13.5458975316877
P01027	>sp|P01027|CO3_MOUSE Complement C3 OS=Mus musculus OX=10090 GN=C3 PE=1 SV=3	C3	16.9141234908881	16.788497031456	17.0492180722116	16.3798160285585	16.4955414113162	16.2344090496953
P01029	>sp|P01029|CO4B_MOUSE Complement C4-B OS=Mus musculus OX=10090 GN=C4b PE=1 SV=3	C4B	15.0274200690209	15.0496097794653	14.7134609524439	14.5870591414698	14.5113309833999	14.2743746822942
P06684	>sp|P06684|CO5_MOUSE Complement C5 OS=Mus musculus OX=10090 GN=C5 PE=1 SV=2	C5	16.0517381125551	16.3271782013433	15.9443789097134	15.6071046592665	14.3946489683223	15.6605683456337
A0A1L1SQZ2;P97445	>tr|A0A1L1SQZ2|A0A1L1SQZ2_MOUSE Isoform of P97445, Voltage-dependent P/Q-type calcium channel subunit alpha (Fragment) OS=Mus musculus OX=10090 GN=Cacna1a PE=1 SV=1;>sp|P97445|CAC1A_MOUSE Voltage-dependent P/Q-type calcium channel subunit alpha-1A OS=Mus musculus OX=10090 GN=Cacna1a PE=1 SV=2	CACNA1A	14.4127623636706	14.7919259855417	14.4391832630285	14.6635564031249	15.2643564247039	14.964509693747
E9PWL1;Q5SUF5;Q5SUF6;Q5SUF7;Q5SUF8;Q5SUF9;Q5SUG0;Q5SUG1;Q5SUG2;Q5SUG3;Q5SUG4	>tr|E9PWL1|E9PWL1_MOUSE Isoform of Q5SUF7, Voltage-dependent T-type calcium channel subunit alpha OS=Mus musculus OX=10090 GN=Cacna1g PE=1 SV=1;>tr|Q5SUF5|Q5SUF5_MOUSE Isoform of Q5SUF7, Calcium channel, voltage-dependent, T type, alpha 1G subunit OS=Mus musculus OX=10090 GN=Cacna1g PE=1 SV=1;>tr|Q5SUF6|Q5SUF6_MOUSE Isoform of Q5SUF7, Voltage-dependent T-type calcium channel subunit alpha OS=Mus musculus OX=10090 GN=Cacna1g PE=1 SV=1;>tr|Q5SUF7|Q5SUF7_MOUSE Voltage-dependent T-type calcium channel subunit alpha OS=Mus musculus OX=10090 GN=Cacna1g PE=1 SV=1;>tr|Q5SUF8|Q5SUF8_MOUSE Isoform of Q5SUF7, Calcium channel, voltage-dependent, T type, alpha 1G subunit OS=Mus musculus OX=10090 GN=Cacna1g PE=1 SV=1;>tr|Q5SUF9|Q5SUF9_MOUSE Isoform of Q5SUF7, Calcium channel, voltage-dependent, T type, alpha 1G subunit OS=Mus musculus OX=10090 GN=Cacna1g PE=1 SV=1;>tr|Q5SUG0|Q5SUG0_MOUSE Isoform of Q5SUF7, Voltage-dependent T-type calcium channel subunit alpha OS=Mus musculus OX=10090 GN=Cacna1g PE=1 SV=1;>tr|Q5SUG1|Q5SUG1_MOUSE Isoform of Q5SUF7, Calcium channel, voltage-dependent, T type, alpha 1G subunit OS=Mus musculus OX=10090 GN=Cacna1g PE=1 SV=1;>tr|Q5SUG2|Q5SUG2_MOUSE Isoform of Q5SUF7, Calcium channel, voltage-dependent, T type, alpha 1G subunit OS=Mus musculus OX=10090 GN=Cacna1g PE=1 SV=1;>tr|Q5SUG3|Q5SUG3_MOUSE Isoform of Q5SUF7, Voltage-dependent T-type calcium channel subunit alpha OS=Mus musculus OX=10090 GN=Cacna1g PE=1 SV=1;>tr|Q5SUG4|Q5SUG4_MOUSE Isoform of Q5SUF7, Voltage-dependent T-type calcium channel subunit alpha OS=Mus musculus OX=10090 GN=Cacna1g PE=1 SV=1	CACNA1G				13.6194688249887	13.4652555676633	13.3170709110584
E9Q683;Q6PHS9	>tr|E9Q683|E9Q683_MOUSE Isoform of Q6PHS9, Voltage-dependent calcium channel subunit alpha-2/delta-2 OS=Mus musculus OX=10090 GN=Cacna2d2 PE=1 SV=2;>sp|Q6PHS9|CA2D2_MOUSE Voltage-dependent calcium channel subunit alpha-2/delta-2 OS=Mus musculus OX=10090 GN=Cacna2d2 PE=1 SV=1	CACNA2D2				12.9934667863689	12.4596078088287	12.903919532962
O88602	>sp|O88602|CCG2_MOUSE Voltage-dependent calcium channel gamma-2 subunit OS=Mus musculus OX=10090 GN=Cacng2 PE=1 SV=1	CACNG2				17.1333954642947	13.3686199528159	14.2023732367286
P11798	>sp|P11798|KCC2A_MOUSE Calcium/calmodulin-dependent protein kinase type II subunit alpha OS=Mus musculus OX=10090 GN=Camk2a PE=1 SV=2	CAMK2A				15.2594525430012	15.3362227332159	15.2580095351099
P28652	>sp|P28652|KCC2B_MOUSE Calcium/calmodulin-dependent protein kinase type II subunit beta OS=Mus musculus OX=10090 GN=Camk2b PE=1 SV=2	CAMK2B				13.6199560862194	11.4884582403817	13.758422937208
Q5SVI1;Q5SVJ1;Q68EG2	>tr|Q5SVI1|Q5SVI1_MOUSE Isoform of P28652, Calcium/calmodulin-dependent protein kinase type II subunit beta OS=Mus musculus OX=10090 GN=Camk2b PE=1 SV=1;>tr|Q5SVJ1|Q5SVJ1_MOUSE Isoform of P28652, Calcium/calmodulin-dependent protein kinase type II subunit beta OS=Mus musculus OX=10090 GN=Camk2b PE=1 SV=1;>tr|Q68EG2|Q68EG2_MOUSE Isoform of P28652, Calcium/calmodulin-dependent protein kinase type II subunit beta OS=Mus musculus OX=10090 GN=Camk2b PE=1 SV=1	CAMK2B				13.1764787459825	13.8843025459928	14.2392182873417
Q5SVJ0	>tr|Q5SVJ0|Q5SVJ0_MOUSE Isoform of P28652, Calcium/calmodulin-dependent protein kinase II, beta, isoform CRA_b OS=Mus musculus OX=10090 GN=Camk2b PE=1 SV=1	CAMK2B	14.7658316069264	14.5602193821502	14.0031236261433	19.688765937175	19.87373582139	19.8863925449286
A0A0G2JGS4;E9Q1T1;E9Q1W0;Q6PHZ2	>tr|A0A0G2JGS4|A0A0G2JGS4_MOUSE Isoform of Q6PHZ2, Calcium/calmodulin-dependent protein kinase type II subunit delta OS=Mus musculus OX=10090 GN=Camk2d PE=1 SV=1;>tr|E9Q1T1|E9Q1T1_MOUSE Isoform of Q6PHZ2, Calcium/calmodulin-dependent protein kinase type II subunit delta OS=Mus musculus OX=10090 GN=Camk2d PE=1 SV=1;>tr|E9Q1W0|E9Q1W0_MOUSE Isoform of Q6PHZ2, Calcium/calmodulin-dependent protein kinase type II subunit delta OS=Mus musculus OX=10090 GN=Camk2d PE=1 SV=2;>sp|Q6PHZ2|KCC2D_MOUSE Calcium/calmodulin-dependent protein kinase type II subunit delta OS=Mus musculus OX=10090 GN=Camk2d PE=1 SV=1	CAMK2D				14.7422114533048	14.4457077786416	15.0155142610352
A0A286YCB8	>tr|A0A286YCB8|A0A286YCB8_MOUSE Isoform of Q923T9, Calcium/calmodulin-dependent protein kinase type II subunit gamma (Fragment) OS=Mus musculus OX=10090 GN=Camk2g PE=1 SV=1	CAMK2G				14.8797198170314	15.5667371802625	15.4512129986209
A0A2I3BQP6	>tr|A0A2I3BQP6|A0A2I3BQP6_MOUSE Isoform of Q923T9, Calcium/calmodulin-dependent protein kinase type II subunit gamma OS=Mus musculus OX=10090 GN=Camk2g PE=1 SV=1	CAMK2G				16.7277384566151	16.9387622948622	16.7627105669932
Q60865	>sp|Q60865|CAPR1_MOUSE Caprin-1 OS=Mus musculus OX=10090 GN=Caprin1 PE=1 SV=2	CAPRIN1	14.4430075312955	14.4961642490521	13.4760470262784			
A2AMW0;F7CAZ6;P47757	>tr|A2AMW0|A2AMW0_MOUSE Isoform of P47757, Capping protein (Actin filament) muscle Z-line, beta, isoform CRA_a OS=Mus musculus OX=10090 GN=Capzb PE=1 SV=1;>tr|F7CAZ6|F7CAZ6_MOUSE Isoform of P47757, F-actin-capping protein subunit beta (Fragment) OS=Mus musculus OX=10090 GN=Capzb PE=1 SV=1;>sp|P47757|CAPZB_MOUSE F-actin-capping protein subunit beta OS=Mus musculus OX=10090 GN=Capzb PE=1 SV=3	CAPZB	12.0228359772042	12.0672308657421	11.9162887275223			
Q9ER72	>sp|Q9ER72|SYCC_MOUSE Cysteine--tRNA ligase, cytoplasmic OS=Mus musculus OX=10090 GN=Cars PE=1 SV=2	CARS	13.5266169890394	14.0785671037161	14.3415274372362	14.0064176302307	13.5252864168876	13.8316290380712
A0A067XG53;O70589	>tr|A0A067XG53|A0A067XG53_MOUSE Isoform of O70589, Peripheral plasma membrane protein CASK (Fragment) OS=Mus musculus OX=10090 GN=Cask PE=1 SV=1;>sp|O70589|CSKP_MOUSE Peripheral plasma membrane protein CASK OS=Mus musculus OX=10090 GN=Cask PE=1 SV=2	CASK				16.3706938800715	16.0889057777246	15.9841682714551
P24270	>sp|P24270|CATA_MOUSE Catalase OS=Mus musculus OX=10090 GN=Cat PE=1 SV=4	CAT	16.7920229146635	16.6737944808454	16.6359533401002	16.5528586919829	16.5382309327063	16.2305421543176
Q9JHG0	>sp|Q9JHG0|CBLN3_MOUSE Cerebellin-3 OS=Mus musculus OX=10090 GN=Cbln3 PE=1 SV=1	CBLN3				15.0038954161661	15.6342461703067	15.155864956126
P60766	>sp|P60766|CDC42_MOUSE Cell division control protein 42 homolog OS=Mus musculus OX=10090 GN=Cdc42 PE=1 SV=2	CDC42				13.5045558968319	14.4352177349574	13.6027066809453
Q80UW5	>sp|Q80UW5|MRCKG_MOUSE Serine/threonine-protein kinase MRCK gamma OS=Mus musculus OX=10090 GN=Cdc42bpg PE=1 SV=2	CDC42BPG	13.8131500083504	14.1554078970039	13.7831558031603	13.4372715998885	13.0071999495322	13.7598388543339
D3YYT0;P15116	>tr|D3YYT0|D3YYT0_MOUSE Isoform of P15116, Cadherin-2 OS=Mus musculus OX=10090 GN=Cdh2 PE=1 SV=1;>sp|P15116|CADH2_MOUSE Cadherin-2 OS=Mus musculus OX=10090 GN=Cdh2 PE=1 SV=2	CDH2				13.4049644507691	13.6467572151494	13.4610761771373
H7BX26;Q6A065	>tr|H7BX26|H7BX26_MOUSE Isoform of Q6A065, Centrosomal protein of 170 kDa OS=Mus musculus OX=10090 GN=Cep170 PE=1 SV=1;>sp|Q6A065|CE170_MOUSE Centrosomal protein of 170 kDa OS=Mus musculus OX=10090 GN=Cep170 PE=1 SV=2	CEP170				11.1141653864031	14.2085407028332	10.8576793637922
F8WGL3;P18760	>tr|F8WGL3|F8WGL3_MOUSE Isoform of P18760, Cofilin-1 OS=Mus musculus OX=10090 GN=Cfl1 PE=1 SV=1;>sp|P18760|COF1_MOUSE Cofilin-1 OS=Mus musculus OX=10090 GN=Cfl1 PE=1 SV=3	CFL1	14.7796621477537	15.1643403875223	14.4266130584736	15.2697678133838	14.4465189669839	15.2052204621413
D3Z0L4;Q9CRB9;Q9D9P1;S4R238	>tr|D3Z0L4|D3Z0L4_MOUSE Isoform of Q9CRB9, MICOS complex subunit (Fragment) OS=Mus musculus OX=10090 GN=Chchd3 PE=1 SV=1;>sp|Q9CRB9|MIC19_MOUSE MICOS complex subunit Mic19 OS=Mus musculus OX=10090 GN=Chchd3 PE=1 SV=1;>tr|Q9D9P1|Q9D9P1_MOUSE Isoform of Q9CRB9, MICOS complex subunit OS=Mus musculus OX=10090 GN=Chchd3 PE=1 SV=1;>tr|S4R238|S4R238_MOUSE Isoform of Q9CRB9, MICOS complex subunit OS=Mus musculus OX=10090 GN=Chchd3 PE=1 SV=1	CHCHD3	14.6177689824849	14.7005218661019	14.8842046578096	14.7128756723976	14.8405272695856	14.6663593515375
B7ZBU7;O70174	>tr|B7ZBU7|B7ZBU7_MOUSE Isoform of O70174, Neuronal acetylcholine receptor subunit alpha-4 OS=Mus musculus OX=10090 GN=Chrna4 PE=1 SV=1;>sp|O70174|ACHA4_MOUSE Neuronal acetylcholine receptor subunit alpha-4 OS=Mus musculus OX=10090 GN=Chrna4 PE=1 SV=2	CHRNA4				11.4607355591575	10.4854274528776	12.72854038494
