protein_id	fasta_headers	gene_symbols_or_id	KO_1	KO_2	KO_3	WT_1	WT_2	WT_3
P68369	>sp|P68369|TBA1A_MOUSE Tubulin alpha-1A chain OS=Mus musculus OX=10090 GN=Tuba1a PE=1 SV=1	TUBA1A	16.5758345592229	16.5086313934158	16.5603014353615	17.1477854270017	17.1843650814018	17.3117171007506
Q7TMM9	>sp|Q7TMM9|TBB2A_MOUSE Tubulin beta-2A chain OS=Mus musculus OX=10090 GN=Tubb2a PE=1 SV=1	TUBB2A	15.2951086354143	15.3010946305429	15.6524546390427	15.5297181476302	16.0013366694791	16.0434540977539
Q9ERD7	>sp|Q9ERD7|TBB3_MOUSE Tubulin beta-3 chain OS=Mus musculus OX=10090 GN=Tubb3 PE=1 SV=1	TUBB3	15.2300601912507	16.0216093603488	15.1857953866586	15.1329538590541	15.7283302179989	15.2087685038902
Q9D6F9	>sp|Q9D6F9|TBB4A_MOUSE Tubulin beta-4A chain OS=Mus musculus OX=10090 GN=Tubb4a PE=1 SV=3	TUBB4A	12.1564527537351	13.1479668216528	12.8929688702699	13.6660394553024	14.116929009457	14.0092456730587
P68372	>sp|P68372|TBB4B_MOUSE Tubulin beta-4B chain OS=Mus musculus OX=10090 GN=Tubb4b PE=1 SV=1	TUBB4B	16.4332930433199	16.2574551370174	16.2581528936853	16.5377920628521	17.0373709088571	16.8628201606658
P99024	>sp|P99024|TBB5_MOUSE Tubulin beta-5 chain OS=Mus musculus OX=10090 GN=Tubb5 PE=1 SV=1	TUBB5	15.2022964905658	14.3601097038361	14.7133277684493	14.8051124577211	15.8137262681407	14.7997691043698
Q8BFR5	>sp|Q8BFR5|EFTU_MOUSE Elongation factor Tu, mitochondrial OS=Mus musculus OX=10090 GN=Tufm PE=1 SV=1	TUFM	14.9556378268654	15.0259347448783	14.7191897870285	14.7697372657815	14.9817601040243	14.4264942686073
Q8BH80;Q9QY76	>tr|Q8BH80|Q8BH80_MOUSE Isoform of Q9QY76, Vesicle-associated membrane protein, associated protein B and C OS=Mus musculus OX=10090 GN=Vapb PE=1 SV=1;>sp|Q9QY76|VAPB_MOUSE Vesicle-associated membrane protein-associated protein B OS=Mus musculus OX=10090 GN=Vapb PE=1 SV=3	VAPB	14.332184837665	15.1948276593212	14.9777532312835	14.3822784278666	14.5610157485449	14.5595243938989
G3UX26;Q60930	>tr|G3UX26|G3UX26_MOUSE Isoform of Q60930, Voltage-dependent anion-selective channel protein 2 OS=Mus musculus OX=10090 GN=Vdac2 PE=1 SV=1;>sp|Q60930|VDAC2_MOUSE Voltage-dependent anion-selective channel protein 2 OS=Mus musculus OX=10090 GN=Vdac2 PE=1 SV=2	VDAC2	16.9966219587062	18.0770635834542	17.5282009359183	16.3484765326588	14.0525917530697	17.690247177408
P62259	>sp|P62259|1433E_MOUSE 14-3-3 protein epsilon OS=Mus musculus OX=10090 GN=Ywhae PE=1 SV=1	YWHAE	10.9473576888287	10.7432320815862	7.56852309755431	12.4882604601075	11.5458006774002	12.4776533644933
F6VW30;F6YY69;P68254	>tr|F6VW30|F6VW30_MOUSE Isoform of P68254, 14-3-3 protein theta (Fragment) OS=Mus musculus OX=10090 GN=Ywhaq PE=1 SV=1;>tr|F6YY69|F6YY69_MOUSE Isoform of P68254, 14-3-3 protein theta (Fragment) OS=Mus musculus OX=10090 GN=Ywhaq PE=1 SV=1;>sp|P68254|1433T_MOUSE 14-3-3 protein theta OS=Mus musculus OX=10090 GN=Ywhaq PE=1 SV=1	YWHAQ	11.6570857795837	13.208619641359	10.212183654401	16.6242749671762	14.6471487828198	15.6567708147104
